{"$schema":"https://json-schema.org/draft/2020-12/schema","$id":"urn:aicontrolcenter:governance:v1:api-envelope","title":"GovernanceApiEnvelope","type":"object","additionalProperties":false,"required":["schema_version","generated_at","status","data_reference","error","evidence_references"],"properties":{"schema_version":{"const":"governance/v1"},"generated_at":{"type":"string","format":"date-time"},"status":{"enum":["OK","ERROR"]},"data_reference":{"$ref":"#/$defs/nullableReference"},"error":{"oneOf":[{"type":"object","additionalProperties":false,"required":["code","message"],"properties":{"code":{"$ref":"#/$defs/code"},"message":{"$ref":"#/$defs/text"}}},{"type":"null"}]},"evidence_references":{"type":"array","uniqueItems":true,"items":{"$ref":"#/$defs/reference"}}},"$defs":{"text":{"type":"string","minLength":1},"code":{"type":"string","pattern":"^[A-Z][A-Z0-9]*(?:_[A-Z0-9]+)*$"},"reference":{"type":"object","additionalProperties":false,"required":["contract_name","resource_id","digest"],"properties":{"contract_name":{"type":"string","enum":["GovernanceAuthorizationRequest","GovernancePreconditionSnapshot","GovernanceAuthorizationDecision","GovernanceAuthorizationReceipt","GovernanceAuthorizationStateRecord","GovernanceMutationBudget","GovernanceAuthorizationConsumptionReceipt","GovernanceExecutionRequest","GovernanceExecutionReceipt","GovernancePostconditionReport","GovernanceFailureEvidence","GovernanceEvidenceManifest","GovernanceEvidenceBundle","GovernanceAuditEvent","GovernanceGitDocumentationGateReport","GovernanceApiEnvelope"]},"resource_id":{"$ref":"#/$defs/text"},"digest":{"$ref":"#/$defs/text"}}},"nullableReference":{"oneOf":[{"$ref":"#/$defs/reference"},{"type":"null"}]}}}
