{"schema_version":"governance/v1","generated_at":"2026-08-10T00:10:00+00:00","status":"OK","data_reference":{"contract_name":"GovernanceAuthorizationReceipt","resource_id":"authorization-synthetic-001","digest":"digest-authorization-synthetic-001"},"error":null,"evidence_references":[{"contract_name":"GovernanceEvidenceManifest","resource_id":"manifest-synthetic-001","digest":"digest-manifest-synthetic-001"}]}
